{"acceptance_gates":[{"gate_id":"operator_decision_record_chain_operator_decision_required","required_before":"any direct repair execution spec or repo-local repair mutation","status":"PENDING_OPERATOR_DECISION"},{"gate_id":"runner_casing_policy_external_hold","required_before":"any script casing normalization claim","status":"OPERATOR_HELD"},{"gate_id":"notion_mapping_evidence_external_hold","required_before":"any Notion completeness claim","status":"NOT_COMPUTABLE"}],"advisory_only":true,"blocked_actions":["DIRECT_REGISTRY_COVERAGE_REPAIR_EXECUTION","DIRECT_OUTPUT_PAIRING_REPAIR_EXECUTION","DIRECT_DOCS_REFERENCE_REPAIR_EXECUTION","RUNNER_CASING_POLICY_OVERRIDE","NOTION_MAPPING_COMPLETENESS_ASSERTION"],"blocked_reasons":["FINAL_OPERATOR_DECISION_RECORD_MISSING","RUNNER_CASING_POLICY_REMAINS_OPERATOR_HELD","NOTION_MAPPING_EVIDENCE_REMAINS_NOT_COMPUTABLE","DIRECT_REPAIR_EXECUTION_AUTHORITY_REMAINS_DENIED"],"canon_mutation_allowed":false,"command":"BUILD_ABX_ARTIFACT_LINEAGE_REGISTRY_DIRECT_REPAIR_OPERATOR_DECISION_RECORD_OPERATOR_DECISION_REQUEST_001","completion_hold_ready":true,"decision_options":["HOLD","AUTHORIZE_SEPARATE_DIRECT_REPAIR_EXECUTION_SPEC","REQUEST_EXTERNAL_EVIDENCE","REJECT_DIRECT_REPAIR_EXECUTION"],"decision_question":"Should Abraxas authorize a separate governed execution spec for repo-local direct lineage repairs after the operator-decision-record subchain reached its explicit completion hold boundary?","decision_record_plan_candidates":["out/operator_review/abx_artifact_lineage_registry_direct_repair_operator_decision_record_plan_001.latest.json","out/operator_review/abx_artifact_lineage_registry_direct_repair_operator_decision_record_plan_001.latest.md"],"decision_scope":"DIRECT_REPAIR_EXECUTION_DECISION_REQUIRED","execution_authority":false,"follow_on_actions_if_approved":["AUTHOR_SEPARATE_DIRECT_REPAIR_EXECUTION_SPEC","OPEN_SEPARATE_DIRECT_REPAIR_EXECUTION_PR"],"follow_on_actions_if_external_evidence_requested":["REQUEST_NOTION_MAPPING_EVIDENCE","REQUEST_RUNNER_CASING_POLICY_DECISION"],"follow_on_actions_if_held":["MAINTAIN_COMPLETION_HOLD","MAINTAIN_EXECUTION_DENIAL","WAIT_FOR_EXPLICIT_OPERATOR_DECISION_EVIDENCE"],"follow_on_actions_if_rejected":["SEAL_DIRECT_REPAIR_CHAIN_AS_ADVISORY_ONLY","DO_NOT_PREPARE_EXECUTION_SPEC"],"implementation_authorized":false,"non_authoritative":true,"priority":"P0","projection_only":true,"promotion_allowed":false,"queue_action":"HOLD_FOR_GOVERNED_OPERATOR_DECISION","queue_mutation_allowed":false,"recommended_decision":"HOLD","recommended_next_action":"review the operator-decision-record completion hold plan, confirm the unresolved hold reasons, and collect explicit operator decision evidence before any separate direct-repair execution spec can exist","request_id":"ad876b8062aadae30e1811d8494df973c4e09003261dc173531136e1c133714e","required_evidence":["FINAL_OPERATOR_DECISION_RECORD_MISSING","RUNNER_CASING_POLICY_REMAINS_OPERATOR_HELD","NOTION_MAPPING_EVIDENCE_REMAINS_NOT_COMPUTABLE","DIRECT_REPAIR_EXECUTION_AUTHORITY_REMAINS_DENIED"],"required_operator_actions":["review_operator_decision_record_completion_hold_plan","confirm_final_operator_decision_record_is_missing","review_runner_casing_policy_hold","review_notion_mapping_evidence_gap","collect_operator_decision_record_chain_operator_decision","record_operator_decision_record_chain_operator_decision"],"runtime_mutation_allowed":false,"safe_to_auto_continue":false,"safe_to_prepare_planning_pr":false,"schema_version":"AbxArtifactLineageRegistryDirectRepairOperatorDecisionRecordOperatorDecisionRequest.v1","source_completion_hold_path":"out/operator_review/abx_artifact_lineage_registry_direct_repair_operator_decision_record_completion_hold_plan_001.latest.json","source_hashes":{"operator_decision_record_completion_hold_plan":"623d99ff0c78350f41b8acfd2381dbacfd31181147f41d6cac40856c7f5d6fe6"},"spec_authoring_only_if_approved":true,"status":"ABX_ARTIFACT_LINEAGE_REGISTRY_DIRECT_REPAIR_OPERATOR_DECISION_RECORD_OPERATOR_DECISION_REQUEST_EMITTED","target_plan_id":"abx_artifact_lineage_registry_direct_repair_operator_decision_record_completion_hold_plan_001","target_surface":"ABX Artifact Lineage Registry Direct Repair","validation_passed":true}
